,MWE,Previous,Target,Next
0,double dutch,This inspired others to jump ropes as a leisure activity and the exercise was passed down from generation to generation until it traveled to America in the 1600s with the children of Dutch settlers.,There are several theories behind the origin of the term “Double Dutch.”,The most popular theory states that “Double Dutch” translates into “gibberish” or a “strange kind of talking.”
1,double dutch,In the age of chivalry a man paid for the woman's dinner and to 'go Dutch' was to do it how 'they' did it: incorrectly.,"Double Dutch also derives from the same era, Dutch seeming a strange and convoluted language hence Double Dutch meaning indescernible, mad and generally all round not on foreign speak.","There are many phrases that include the word: 'Dutch', such as Dutch uncle and Dutch courage."
2,double dutch,"To her eternal credit, she kept both India and Pakistan as our friends during and after the 1971 Indo Pakistan war.","Since 1977 we have had a plethora of Foreign Ministers, to whom the subject of foreign affairs was double Dutch.","We need to exclude from that list the late Mr Lakshman Kadirgamar, a skilled and highly competent Foreign Minister."
3,double dutch,"While pharmaceutical companies were researching and developing the vaccines, they promised that this was a people’s vaccine and it would be distributed equitably.",Turns out that these people were speaking double Dutch.,"So why aren’t Big Macs sold all over the world, especially in countries like ours?"
4,double dutch,Coronavirus in Europe   * Brexit   * Brussels Playbook   * London Playbook,Is Flemish premier talking double Dutch?,Three months before the Belgians take over the EU presidency the omens for a truce between the country's Francophone Walloons and the Dutch-speaking Flemish are not looking good.
9,night owl,"The job has traditionally been nonpolitical, but Mrs. Trump’s decision to hire a Trump Organization employee added partisanship to the role, even though Mr. Harleth tried to frame his work there as one stop in a long career in the hospitality industry.","The White House job was well compensated — former chief ushers say salaries run in the $200,000 range — but the days are long, particularly if the president is an early riser or a night owl; Mr. Trump was both.","Mr. Biden is not a morning person, people familiar with his schedule say.)"
10,night owl,I remember when we members of the Sports Department were responsible for designing the sports pages for each day's paper.,"I didn't have to do that very often, thank God, but when it was my turn to lay out pages, I would either have to get up before dawn to get the Sports section done (a horrible fate for a night owl like myself) or stay at the office until 2 or 3 a.m. working on the next day's Sports section.","Either way, I don't miss those days."
11,night owl,"But if you'd prefer trying your hand at some custom content, Make a Square also features a custom level designer where you can create your own stages from scratch and then send it to other users to play and rate.",Bonus features such as achievements and a dark mode for the night owl mobile gamers are also included should you need them.,You can download Make a Square from the iOS App Store and Google Play for Android.
12,night owl,"The other is the direct effect of the bright light therapy to the biological mechanism of depression, for example, affecting the brain stem nucleus, changing their serotonin balance,"" he said.","The researchers said experience shows ""night owl"" patients with depression are less likely to recover and are more likely to commit suicide.",They said the bright light therapy can assist medication in treating these patients.
13,night owl,Researchers tested participants' leg muscle strength at various points in the day.,"They looked at nine ""early birds"" and nine ""night owls,"" who were classified as such based on a questionnaire.","Surprisingly, morning people's strength tends to remain constant throughout the day, but night owls have peak performance in the evening, said researchers from the University of Alberta in Canada."
14,night owl,"Some people who appear to have insomnia are biologically night owls, one expert says.","Experts say a spectrum of natural sleeping and waking rhythms exists, ranging from extreme morning people to extreme ""night owls.""",A new study examines how morning people compare with night owls on a strength test and looks at what other physiological processes may contribute to their performance.
15,night owl,"Heading outside (even just for a couple of minutes) or doing mundane things like brushing your teeth and making the bed can help your mind accept the fact that yes, alas, you are awake now.","Whether you're a night owl or early bird, though, try to make sure you're not diving right onto your phone.",Your morning will start calmer if you don't dive right into work emails and scrolling.
16,night owl,"Experts say a spectrum of natural sleeping and waking rhythms exists, ranging from extreme morning people to extreme ""night owls.""",A new study examines how morning people compare with night owls on a strength test and looks at what other physiological processes may contribute to their performance.,Researchers tested participants' leg muscle strength at various points in the day.
17,night owl,"Their body clock is separate from what their work clock is supposed to be,"" Collop said.","It's very difficult for a night owl to become a morning person, Collop said.","At a sleep clinic such as the one at Johns Hopkins, people seeking to change their habits may be asked to sit in front of a very bright light early in the morning and to take melatonin to help them sleep earlier."
18,night owl,"It would have been terrific if getting them to hit the sack as teenagers were as easy, but….no such luck.","Their biological clocks shifted into “night owl” gear, and their activity and homework demands rose, just as my husband and I sunk into middle age.","Consequently, we wrestled with our closing eyelids by 10 p.m. while they were raring to go until at least midnight."
19,night owl,"I explain that a cicada is a locust, while circadian refers to patterns of sleep and wakefulness in relationship to light and darkness.",He has always been a night owl and I have always been an early morning person.,"If the day comes that I am not up by 5, I am probably seriously ill. Or — as I recently read in someone’s obituary — “not able to do lunch.”"
20,night owl,"Or anything, probably.",Ben Salmon is a committed night owl with an undying devotion to discovering new music.,"He lives in the great state of Oregon, where he hosts a killerradio show and obsesses about Kentucky basketball from afar."
28,blood bath,"In its reply, the RCL warned: “In the first place, it [the rejection of a united front] is an act which is absolutely hostile to the active organisation of practical measures by the working class against its class enemy.","Second, it ties the working class to fronts formed on bourgeois programs, weakens and politically disarms it, and creates the opportunity for the class enemy to drown the working class and the poor peasants in a blood bath.”","The “left” parties dropped any criticism of the government’s repressive measures and received arms in return, while hundreds of militant workers and trade unionists paid for this treachery with their lives."
29,blood bath,Ben Cox pummled his opponent Nate Meyer into a TKO victory maintaining his 170lb Amateur Title.,Mojo Horne turned Brendan Seguin into a blood bath as he dropped countless elbows onto Seguins face while mainintaining a dominating mounted position Seguin simply couldn't get out of and kept hold of his 185lb Pro Title.,Roger Bowling ended Seth Baczynski in all of 9 seconds in the first round catching an awe inspiring knockout blow causing Seth to be knocked out while suspended in the air with a look on his face that to this moment is still embedded into my memory.
30,blood bath,"The arrival of President Joe Biden to the White House from a general “Israel” consensus point of view is, it’s not as good as the Donald Trump years, but it won’t be as bad as the Barak Obama era.","The US embassy will remain in Jerusalem, as this act was the implementation of a law passed by Congress in 1995, despite wild predictions of a “blood bath” if a move took place.",We also know that the huge success stories of peace and trade treaties between Israel and the Gulf States were welcomed and will be encouraged to grow and flourish.
31,blood bath,"Why would the western media outlets write headlines that paint the Ethiopian defense force ""as the invading force""?","It is not because these media outlets don't know the truth, it is because they want a blood bath in Ethiopia by garnering support for the TPLF.","With the intention of internationalizing the conflict, the western media is reporting fabricated news asserting Eritrean soldiers are not only in Tigray but that they are looting properties in Tigray and selling them in the street of Asmara."
32,blood bath,"It came as a terrible shock to the Inyo officers when the vicious record of the Family … came out into the open,” wrote Bob Murphy, the park’s superintendent in 1969, in a book called “Desert Shadows” about the Manson Family’s apprehension.","Death Valley could well have had its own blood bath, had the officers provided the opportunity.”","You can read this and other stories about history, nature, culture, art, conservation, travel, science and more in National Parks magazine."
33,blood bath,"When a prominent left winger called for the destruction of the state itself as a necessary step towards revolution and transformation, the public and the formal political parties and politicians were worried and disenchanted.",No one in Egypt wants a blood bath or purges that may unjustly injure or dispossess the innocent.,"However the state in Egypt can only be transformed through a systematic and methodical engagement with its functions, values, and processes."
34,blood bath,"As a testament to the scene's power, these reactions videos are practically indiscernible from the reactions videos for ""Two Girls, One Cup.""","There are countless videos of people reacting to the blood bath that was the Red Wedding, but here's a nice compilation to get you started.","Actress Maisie Williams, who plays Ayra Stark on the show, even uploaded her own reaction video (originally to Vine), which helped lighten the spirts of otherwise heartbroken fans."
35,blood bath,"Today I want to say each and every Indian who is supporting these riots is also a terrorist including anti national brands,"" Kangana Ranaut tweeted on Republic Day.","Sick and tired of riots and blood bath almost every month , Delhi, Bangalore and now again Delhi #RedFort,"" the actress wrote in a separate tweet.","The actress also shared a video speaking in Hindi, where she said: ""We have become a joke before the world today."
36,blood bath,"Kangana said it was disappointing to watch protests turn violent, that too on Republic day.","She captioned her video on Twitter, “Sick and tired of riots and blood bath almost every month, Delhi, Bangalore and now again Delhi.”",Farmers were told to start their rally after the official Republic Day parade gets over.
37,blood bath,This triggers a cutscene showing that Mongols have broken into the Steward's Keep and the stronghold is about to fall if you do not intervene.,"Make your way back to the stronghold, again either leaving a blood bath in your path or sneak back to the stronghold.","You need to get to the keep, and you can again get there by using stealth or killing all the Mongols in your path as you do so."
38,blood bath,"Putting the truck in reverse, they noticed it was an elderly woman, covered in blood, sitting on a piece of machinery.","Davies said they found ""A woman with no shoes on, blood all over, one eye was completely shut, hair missing, just a blood bath.""","The elderly woman asked for help and said her son had tried to kill her, according to Davies' testimony."
39,blood bath,"ET      When her father passes away, a beautiful young woman finds solace in a new boyfriend.","But when he ropes her into one of his criminal schemes, she finds herself in the midst of a brutal blood bath, willing to step in and save her man's life…by any means necessary.",FOR MY MAN is produced by Jupiter Productions for TV One.
40,blood bath,"Using powerful explosives that had been smuggled into the prison, the men destroyed two armored doors and ended up in front of the prison's main gate.","To avoid a blood bath, prison officials ordered the gate to be opened.",The escapees stole a vehicle from the prison parking lot and piled in their hostages.
41,blood bath,"Ousted President Manuel Zelaya has vowed to return to Honduras on Sunday, despite being threatened with arrest.","The Honduran Catholic Church called on all parties to avoid a ""blood bath"".","In a speech on the regional TV channel, Telesur, Mr Zelaya said he would arrive along with several other presidents."
42,blood bath,"You are funded by your audience, so you have to keep yourself admired by slaughtering the monsters.",Take the challenge and come out victorious from a blood bath with ferocious beasts!,"Become a champion of the show, full of blood, pain and insensate cruelty."
43,blood bath,"If the insurrectionists were Black they would all be dead.""","If the rioters were Black it'd be a blood bath.""","While the revelations are true, each time I saw one of these posts on social media it felt like the quick jab of a knife in my side."
44,blood bath,That's not a fun place for Team Biden to be in.,"It's going to be a blood bath.""",Maybe McDonough can swiftly use his crisis management skills to skillfully evade blame for this mess and others Trump has left him.
45,blood bath,"We just have to stick to the same plan we’ve had all along, HOLD!!","We didn’t go through the blood bath last week for nothing, keep it up boys!!""","a user posted, referring to GameStop's decline from nearly US$500."
78,fine line,"There are things that are within your control and things that aren't,"" Curry said.","But all the little things that you do on a daily basis, all the work that you put in, is building towards getting back to that stage and understanding—you're living in reality so you know unless you're playing quarterback for the Tampa Bay Bucs right now, there's a fine line between when you're at your peak and when you need to really get the most out of what you got on the court.","That's kind of the perspective, so definitely think about it."""
79,fine line,"Still, on Monday at TPC Scottsdale—fresh off playing in the final group on Sunday at the Farmers Insurance Open—Burns went to the tour truck in search of a new big stick.","It’s a fine line for a rep knowing when to approach a player about a switch,” said Jacob Davidson, PGA Tour rep for Callaway.","One of the things we’re constantly doing is monitoring their stats through ShotLink, and we know Sam has a DNA he needs to be operating at from a spin and launch perspective when he’s playing his best golf."
80,fine line,A big bag of nothing” is a fair assessment of what many parents feel online schooling has provided for their children.,"There’s a fine line between Rahm Emanuel’s exhortation to make sure a crisis “never goes to waste,” and turning a health crisis into a national education emergency, and using children as pawns in a political struggle.","If the unions don’t alter their stance and start prioritizing children’s education, they may quickly find they have no bargaining chips left to play."
81,fine line,"Especially when we see the pictures from overseas where countries still ravaged by Covid are locked down, shut, excluding people from daily activities.","But it’s a fine line isn’t it, between being grateful and aware of our privilege here, and being complacent.","My Mum was telling me the other day that she’s always surprised at how few people sign in anywhere, or use the contact tracing app."
82,fine line,"Part of that comes from its more aggressive toe spring, and the rest comes from the softer foam, lighter weight, and deeper flex grooves.","As a smaller runner, I have found that there is a fine line between cushioned trainers feeling supportive and feeling overbuilt; the Cumulus 22 walks that line well.",The Cumulus 21 (left) has a slightly stiffer ride than the 22 (right).
83,fine line,The next few months will be interesting.,"As we head towards the deadline for taking advantage of the stamp duty holiday, lenders are navigating a fine line between the need for volume and market share versus risk appetite and service.",There is a certain amount of chopping and changing on rates and products as lenders deal with unprecedented circumstances.
102,fall guy,"The former Team Sky and British Cycling doctor Richard Freeman was working with “sleepers” in the organisations, who had previously used banned drugs, when buying testosterone to boost the performance of an unnamed rider, his medical tribunal has heard.","Summing up the General Medical Council’s case, Simon Jackson QC said Freeman had “lied at every stage” about ordering 30 sachets of Testogel in 2011 – and then had tried to cover up his “web of deceit” by setting up the former head coach Shane Sutton as “the fall guy”.","Dr Richard Freeman 'crossed line' buying banned drug, tribunal hears"
103,fall guy,The Penguin hates Batman with a passion since the Dark Knight is continuously trying to bring this known criminal and Gotham City's almost untouchable crime boss to justice.,"In the Rebirth Era, Jason Todd's origin received another retcon when it came to the villain responsible for the death of his father, who was working for and became the fall guy for the scam Penguin was running at the time.","Upon learning this, Jason, now operating as Red Hood, attempts to kill Penguin and later takes over his criminal empire for a short time, intent on ruining Penguin, who he was holding captive."
104,fall guy,"He supposedly epitomized all the worst ills of society, from a bigoted racist buffoon to a conniving orchestrator of the greatest election heist of all time — 2016, that is, not 2020.","In truth, Trump was the Leftmedia’s fall guy, the one on whom it could blame everything.","There was no effort to offer any cogent argument against Trump’s policies, because its “orange man bad” trope trumped any need for honestly engaging in the very real issues facing the country."
105,fall guy,"When the calendar turned to 2021, the company hadn’t met requirements to pay its $6.4 billion CVR Bristol Myers issued with the Celgene merger.","Ahmed’s departure will raise questions over whether he was a “fall guy” or potentially even a whistleblower for potential litigation, Syed said.","Investors are wondering why the established drug maker struggled with regulatory procedures for key drug applications, and whether it was negligent."
106,fall guy,"The mayor asked me to provide false information to support her narrative,” he said, becoming adamant when Celli pushed back, suggesting there was simply a difference of opinion.","In notes for a media statement he never sent, Singletary wrote he was “made out to be the ‘fall guy,’” as those in City Hall scrambled to save their political careers.","I wish I had documented every single thing, now that I know what I know,"" he said."
107,fall guy,It's not often that a substituted substitute is the hero.,"On a night when Union Berlin's remarkable season hit new heights, Cedric Teuchert emerged as the hero when he'd looked like being the fall guy.","Teuchert, a first half replacement for the injured Sheraldo Becker, emerged as Union's chief goal threat – and when he went clean through five minutes into the second half, everything stood still for a moment."
108,fall guy,Miguel is the man that makes it possible for the Pastor to do what he does flawlessly.,"Although he is the 'fall guy' when things don't go the right way, Pastor Hartley has come to depend on Miguel over the years — no matter what goes wrong during rehearsals and concerts, Miguel find's a way to pull it together and make it all work.",They've known each other for over 25 years
109,fall guy,"If it happens, a fan base of which many are already viewing coach Jon Gruden with skepticism will again clamor for change at the top.","More likely, it would be general manager Mike Mayock being the fall guy as this year's Paul Guenther.","Mayock becomes mostly invisible once the season starts, receding into the background with Gruden doing all the talking."
131,crocodile tear,"People danced, added other songs (amapiano mostly).","Now he’s shedding a crocodile tear,” said Shivambu.","Fact is, crocodile tears are caused by where we are, what we ate and drank.”"
132,crocodile tear,"Sentencing Dhillon to serve a minimum of 22 years, Judge Paul Sloan QC, said: “Not a shred of remorse have you shown from first to last.","Indeed, you were concentrating so hard on getting your story right when giving evidence, you forgot even to shed a crocodile tear.”","Trimaan ‘Harry’ Dhillon, 26, who has been jailed at Newcastle crown court for life with a minimum term of 22 years for the murder Photograph: Northumbria police/PA"
133,crocodile tear,"Eighty per cent of beneficiaries under the Act would be Dalits, Nadda claimed.","Congress sheds crocodile tear for Dalits...It only used them for political ends....80 per cent of those being provided citizenship under the Act are Dalits,"" he said.","Communities such as Matua, Rajvanshi and Namo Sudra migrated to India from the three neighbouring countries and they would be the biggest beneficiaries of the CAA, he said."
134,crocodile tear,"This act of genocide took place in the shortest time, using primitive methods.","It is shocking to think that 20 years after the massacre, the international community sheds a crocodile tear when it is obvious to everyone that this genocide could have been prevented easily.",Unilateral threats from the international community against tiny Rwanda would have been enough to stop the Hutu leaders from carrying out their plan.
135,crocodile tear,"Most people were - and continue to be - deeply moved by the devastation and needless loss of human life that took place on Friday evening, and generally the media coverage has been respectful and nuanced.",But there's always a point at which genuine sentiment and heartfelt emotion morphs into cynical manipulation and crocodile tear territory.,Chaotic scenes as people flee Paris ahead of second lockdown
136,crocodile tear,"There was last week's confirmation of the long-anticipated, long-delayed death of the Sun News Network — the Conservative party propaganda arm dressed up to look like “news” outfit.","Predictably, much of the media tribe in and outside Ottawa scolded callous, vindictive “leftists” for not shedding a crocodile tear over the demise of Canadian TV's boorish version of Pravda.","Reading their soppy tweets and obituaries, you might have thought that Ezra Levant and company were performing some noble public service by giving voice to every cheap racist, demagogic, xenophobic, Islamophobic slogan that made up the sorry signature of SNN’s blessedly short life span."
137,crocodile tear,"The whole nation is going to benefit, you know, this is the financial hub of the country and we want this to happen.""","However, he said Auckland Transport, CRLL, Auckland Council and central government did not care, or ""even shed a crocodile tear"", for the struggling Albert St businesses.","They haven't come forward asking: 'hey guys, how are you, are you surviving'?"""
138,crocodile tear,Barack Obama has maintained an uncanny ability to avoid being blamed for the situation the US finds itself in.,"Partly this is due to the superficial approach of small-l liberals, for whom an eloquent speech and a crocodile tear are enough to forgive any number of crimes.",Partly it is the persistence of lesser-evilism.
139,crocodile tear,"So yeah, it's really awful those neighbors are being rule-stickler meanies to poor Trump.",Remind me to shed a crocodile tear or two over't.,All I am saying is that we are making Putin look honest.
140,crocodile tear,"Don't cry for K-Fed; rounding off his divorce settlement at $1 million for 25 months of matrimony, that means he got paid $17,857.14 a week for his husbandly chores.","No, if you do anything this weekend, shed a crocodile tear for the following K-Oed bunch.","Daniel Sadek: The real-estate-investor-turned-film-producer willingly crashed a couple of his Porsche Carrera GTs during the making of ""Redline,"" a $26 million action flick he is personally financing."
141,crocodile tear,She saved us from all that!,"Then, as now, the world seemed a dangerous and volatile place, and it was easy to whip up fear at the drop of crocodile tear.",At times it seemed that nothing but the dread of a sound handbagging stood between us and perdition.
142,heavy cross,Republic of Telly's Bernard O'Shea headlines a great night of comedy at The Bankers Bar and Comedy.,"One of Ireland's funniest comedians 'Bernard' brings his unique comedy views on the world ranging from why being christened 'Bernard' has been a heavy cross to bare, to what you should put in you washing machine.","He will joined by Johnny Candon (Ricky Gervais Tour), Kevin Goldsmith, and Maria Boyle."
