,MWE,Previous,Target,Next
810,contact lens,"Doctors from Moorfields Eye Hospital in London said that, in some cases, this could develop into microbial keratitis, in which the cornea becomes inflamed after infection by bacteria, fungi or amoebae.",A number of recent studies have highlighted the dangers of infection from contact lenses.,"In April, opticians issued warnings over fashion lenses featuring novelty designs such as cats eyes, spirals and flames."
829,honey trap,Accused Shweta Vijay Jain​'s​ lawyer Dharmendra Gurjar informed the trial court that they would move a petition in HC requesting it to vacate the stay.,"A special trial court on December 4 had directed the Special Investigating Team, which is probing into the honey trap case, to give copies of documents and evidence (pen drive, hard disk, floppy etc) to accused Shweta Vijay Jain.","Unwilling to hand over copies of the crucial electronic evidence, the SIT had filed ​a ​petition in the court seeking to quash the trial court’s order."
830,honey trap,Head of Hamas delegation Saleh Arouri and Fatah leader Azzam Ahmad sign a deal in Cairo (Reuters),"We are concerned that Hamas is setting up a honey trap for us, to make us carry the burden of providing services in Gaza while they continue ruling the strip from inside,"" a Fatah official said.","The full text of the deal has not been made public, although about 3,000 PA police are expected to be deployed in Gaza and control of the Rafah crossing between Gaza and Egypt is expected to pass into PA control."
831,honey trap,"Hegde had recently grabbed the headlines after he came out with a claim that singer Renu Sharma, who accused Maharashtra Social Justice Minister Dhananjay Munde of rape, had tried luring him into a relationship since 2010.",He also filed a complaint at Amboli police station against the singer for plotting a honey trap and blackmailling him since 2010.,"Through my sources, I found out that she is a dubious person who is setting up a honey trap."
832,honey trap,"He urged that the police immediately register a case against Sharma, and conduct a thorough investigation.","This is a process to lure, honey trap, blackmail and extort money and I would request the Mumbai Police to file a FIR and take the matter to its logical conclusion,"" he stated in his complaint.","This is to inform that one woman has been calling me, messaging me and coaxing me since 2010 to have a relationship with her."
833,honey trap,"However, Karl felt guilty about the affair and eventually ended things with Sunita, leaving her incredibly angry.","In a bid for revenge, Sunita lured Karl into a honey trap and while she was helping him close up the pub for the night, seduced him.","She also deleted a message from Stella to him, saying that she, Eva and Leanne were heading home."
834,honey trap,Earlier forest officials had brought urine of a female tigress from Mysuru Zoo and sprayed it near the trap to attract the animal and cage it.,But it failed to fall into the “honey trap”.,"For the last two days, at least 70 forest officials and local people have beenpressed into service to locate the male tiger."
835,honey trap,She tried many times to get to close to me.,"Having realised that she had honey trap several influential people, I tried to distance myself from her”.","Since she is a woman, I did not want to defame her and did not complain to the police."
836,honey trap,"When Emma's friend and surgery co-worker, Zara Carmichael (Elisabeth Dermot Walsh) finds out what's happened, she wants to get REVENGE!",Emma is not particularly keen but Zara sets a plan in motion to catch Aashiq in a honey trap.,"In disguise, Zara poses as a flirty client and arranges to meet Aashiq at a restaurant to discuss ""business""."
837,honey trap,"In another case, a Wayanad-based woman, K K Bindu, was arrested in December for mortgaging 5.5kg of imitation gold at the Union Bank branch on PM Taj Road in Kozhikode and duping it of I1,69,51,385.","The Infopark police in Kochi on October 30 arrested three men and a woman in connection with laying of a honey trap that culminated in the murder of Kollam native Divakaran Nair, 65, whose body was found from Kakkanad on October 25.","The arrested were Anilkumar, 37, Sanjay, 23, Rajesh, 37, and Shanifa, 55."
838,honey trap,"When I was going to the police station, Manish Dhuri from MNS also called me and informed me that he had a similar experience with that lady,” Hegde said.",Manish Dhuri from Maharashtra Navnirman Sena (MNS) in Mumbai also alleged that the woman first tried to honey trap him by calling at her flat in Andheri a few years ago.,It was in 2008-2009 when she messaged me from a VIP number and a conversation started between us.
839,honey trap,"He must have found no one today with the mettle of Churchill to challenge him, but many cowards and risk-averse “leaders” instead.","And he surely knows many traitors within the West, including those who have been blackmailed by China’s honey trap and bribery programs.",That would have assured him of the likely success of a war strategy to make the West panic and lock itself down.
840,honey trap,"It captured ""the type of insight that can thwart a vital supply route, reveal a planned ambush and identify and track key individuals.""","Despite the high-tech tools used in the attack, the hackers also relied on a well-worn tactic: the ""honey trap.""",Targets were contacted on the chat and online phone service Skype by hackers posing as pro-opposition women.
841,honey trap,"Philip uses ""Clark,"" the show's longest-running alter-ego, to seduce and eventually marry the secretary of an FBI agent, Martha.","While this move may seem like an exaggeration of the classic ""honey trap,"" it has roots in real-life espionage.",Elizabeth Jennings' impressive disguises represent the Cold War's emphasis on human assets.
842,honey trap,"In April 2010 a video was posted that showed Limonov, Viktor Shenderovich, and Alexander Potkin having sex with the same woman in the same apartment.",Shenderovich described this as a honey trap arranged by the Russian government.,"Soon, Limonov split up with the liberal opposition."
843,honey trap,"Sir Geoffrey Harrison, British Ambassador to Moscow, was the target of a KGB blackmail attempt in 1968, when they placed an attractive maid named Galya in the diplomatic mission. ","Sir Geoffrey fell for the honey trap, and Galya told him that pictures had been taken and that he would be exposed unless he provided information to the KGB.","The scandal broke, but Sir Geoffrey had no action taken against him and he retired on full pension."
844,honey trap, The large number of documents uncovered by the CBI resulted in many more arrests such as Abhishek Verma and Wing Commander S.L. Surve.," Also arrested was Rajrani Jaiswal from Pune, who was apparently used by Kulbushan Parashar as a ""honey trap"".","Surve, who was posted as joint director (air defence) in the Air HQ, was so besotted with Rajrani that Surve's wife complained to the IAF about them. Eventually Surve was fired. "
845,honey trap," This request for military information did not greatly disturb MI5, who expected a GRU officer to ask such questions.","Profumo's interest in Keeler was an unwelcome complication in MI5's plans to use her in a honey trap operation against Ivanov, to help secure his defection.","Woods therefore referred the issue to MI5's director-general, Sir Roger Hollis."
846,honey trap,The Senator will conduct hearings to establish evidence of their corrupt conduct with Taylor's cronies deciding Taylor he will be the fall guy.,Taylor has one chance to avoid imprisonment; lure the Republican Senator into a honey trap.,"Searching for a woman, Taylor's friend Madame Yvonne Bordelaise recommends the visiting European woman Marina Von Minden who is desperately seeking money to obtain a visa for her mother to leave Europe."
847,honey trap,"She was named Best Actress at the 1955 Cannes Film Festival for her performance in A Big Family, directed by Iosif Kheifits.","In 1958, she was involved in the Ambassador Dejean Affair: Kronberg lured Dejean in a honey trap.","She was in a long-time relationship with World Chess Champion Mikhail Tal since about 1960, they parted in the late 1960s"
855,nest egg,"Ongoing concerns over the COVID-19 pandemic has led to 62 per cent of Metro Vancouver businesses still experiencing decreased sales volumes, according to a new survey from the Greater Vancouver Board of Trade.",The survey looking into the business impacts of the pandemic also found seven in 10 businesses impacted by holiday spending reported lower revenues compared to previous holiday seasons -- depriving the businesses of the nest egg typically used to navigate the tougher winter months.,"The information was gathered in a survey of the Board of Trade’s members, done in partnership with the Mustel Group."
856,nest egg,"It helps when the stocks perform as hoped, of course — and watching your portfolio swell in value can be very exciting.","Just understand that building a big nest egg for retirement is a long game, and that the stock market will rise for some periods and fall for others — but over the long run it has always gone up.","Interestingly, Tilray and fellow cannabis producer Aphria announced in late 2020 that they would be merging, creating the world’s largest cannabis company (based on revenue)."
857,nest egg,"Known as “baby bonds,” the government would add up to $2,000 every year depending on income.","Recipients could begin withdrawing money from their accounts at age 18, giving them a nest egg to tap to spend on things like a college education, a downpayment on a home, or start a small business.","The funds would sit in a U.S. government account paying around 3% interest, and Booker, a Democrat, said the money would help narrow the economic gap between rich and poor."
858,nest egg,"While a QBOAD could be a quick way to get up to $5,000 per parent per child to help fund the immediate expenses of your growing family, it is not without consequences.","Money in hand today has value, but forgoing the future value of a $5,000 distribution could result in a significant reduction of your future retirement nest egg.","While you may recontribute the money you distributed, you may only recontribute the actual amount of your distribution."
859,nest egg,"While you’re still working, a diversified portfolio of stocks and bonds is an efficient way to save for retirement.","But once you’ve retired and are drawing down that nest egg, income annuities can outperform bonds, some economists’ research shows.","The most efficient portfolio for retirees consists of stocks and income annuities, says Wade Pfau, a professor of retirement income at the American College of Financial Services."
860,nest egg,"A.G. Edwards' annual Nest Egg Index measures a dozen statistical factors including participation in retirement savings plans, personal debt levels and home ownership.",It shows geographic regions where people are succeeding and where they face the greatest difficulty in building and nurturing their nest eggs.,"Edwards residents are above the national average in several categories, including savings and investing."
861,nest egg,You have been dismissing our articles about top hedge fund stocks mostly because you were fed biased information by other media outlets about hedge funds' poor performance.,You could have doubled the size of your nest egg by investing in the top hedge fund stocks instead of dumb S&P 500 ETFs.,Below you can watch our video about the top 5 hedge fund stocks right now.
862,nest egg,"In his book, Richards suggests that complacency on the part of ordinary citizens will lead to more serious financial disasters.",He encourages readers to take steps to prevent future crises and protect their own nest eggs:,"n Get informed: “Many culpable entities used the crisis fallout to lay blame elsewhere and increase their own power,” says Richards."
863,nest egg,Now you need to determine how much money you'll be able to invest over the remaining years of your career.,Your new adviser will easily be able to put together projections to help you understand what sort of nest egg you'll be working with on your chosen retirement date.,"That's just math, and you should resist the urge to overcomplicate that process."
864,nest egg,"The centrepiece is the proposition that retirees must live off their savings and the equity in their home, not only the earnings on their investments.",Savings should not be seen as building a legacy or nest egg to be bequeathed to the next generation.,All savings must be exhausted and the family home monetised to fund living standards in retirement.
865,nest egg,"It was impossible not to just stick in savings,” June said.",It just made the most sense to be able to have that nest egg and that security blanket there.”,"If there’s a third stimulus check, she intends to put some money into savings and some toward paying off her student loans, which she has already whittled down from $40,000 to about $15,000."
866,nest egg,I plan to continue to do this each year in order to take advantage of the power of the stock market and compound interest.,Investing consistently over time is how I plan to build a large nest egg and leave an inheritance to my children or nieces and nephews.,I want to build wealth that can be passed onto to future generations.
867,nest egg,"The economics of the game aren't the same, of course, and the motivation of an athlete to reach financial security can be satisfied in one stroke of a pen.","Even adjusting the salaries of Aaron's era to today's dollars, ballplayers didn't have the leverage, and thus the earning power, to build that nest egg in similar fashion.","According to research reported by baseball-reference.com, Aaron is listed as earning $6,000 as a Milwaukee Braves rookie in 1954 and his top base salary was $240,000 each of his last two seasons with the Milwaukee Brewers."
868,nest egg,"Fortunately, I had a 401k in my old job, but I was downsized five years too soon.","Now in the gig economy with a 75% pay cut, I’m trying not to sell my blood or organs in order to avoid eating our nest egg.",It dawns on me that many Americans failed to see the necessity of investing in order to offset the country’s decades-long stagnation in salary/wage/traditional interest income.
869,nest egg,"However, contrary to popular belief, that's a risky way to fund your ""golden years.""","While most homeowners think that their home is their nest egg, many homeowners unknowingly reduce equity by borrowing against their homes for other expenses, reports Reuters.","We all say people will sell their house and that's how they are going to live,"" says Bev Moore of Mainstay Investments, in the Reuters report."
870,nest egg,"It just diminishes the desperation of relying solely on real estate as a thing you do when you get married and have kids,” she added.","It is the one nest egg that can build that intergenerational wealth,” said Sara Sutachan, senior vice president of the California Association of Realtors (CAR) and co-creator of CAR’s WomanUp! program, who moderated the panel.",
871,nest egg,"So, when Sam Bradford, Case Keenum, or Kirk Cousins passed the football, both men were deserving of targets.",Evidently – Diggs wanted his own nest egg of attention.,"Without Thielen on the Bills, Diggs got it."
910,silver spoon,"Like Highsmith’s book, the film isn't structured like a traditional thriller.",It instead favors a detached ambivalence about its seemingly nebbish hero as he agrees to become an errand boy for the rich by traveling to 1950s Italy in order to retrieve a silver spoon cad (Jude Law) for his father.,"But the more time Tom Ripley (Damon) spends with Law’s Dickie Greenleaf, the more he grows envious of Dickie’s lifestyle, his wealth and confidence, and maybe even his affection for socialite Marge (Gwyneth Paltrow)."
911,silver spoon,Bannon is a Harvard educated Goldman Sachs alum who ran his own boutique investment banking firm before becoming a Hollywood producer.,"He's every bit as ""elite"" as the establishment Trump — himself a silver spoon billionaire and television star — promised to dismantle.","Some of Trump's policies may show promise, but in his final hours, Trump once again proves that his base needs to let him descend to the ash heap of history while they find another hero."
912,silver spoon,"They come from this very wealthy, upper class, East Coast family, used to vacations in Montauk and things of that sort, and Nico is reluctant to play into that path.",He's trying to move away from his silver spoon past in an effort to be more humble and live more humbly and get along with his college peers in a way that doesn't use the hand that he's been dealt.,"He is also a shoulder to lean on for his baby sister, who is wrapped up in that past still."
913,silver spoon,"These days, becoming a real racing driver only appears likely if you're freakishly talented and have a billionaire daddy who owns a race team.","Before you curse your lack of silver spoon, it's possible to get a tiny window into being a Dan Ricciardo or Mark Webber, albeit without the massive salary and adoring fans.",Porsche’s Track Experience gives the average punter a chance to sample some of their famed machines.
914,silver spoon,"As a result of his brilliance and hard work, his rise is very fast…","The young man represents the children of Abel, those with rags to riches story, while Jane represents the children of Cain, successful silver spoon kids.","I got the inspiration for the captions from the novel, Cain and Abel."
915,glass ceiling,"To create the portrait, Berger lightly hammered sheets of laminated glass while referencing a photo of Harris taken by photographer Celeste Sloman, according to a press release from the National Women's History Museum, which presented the piece and cosponsored the project with Chief, a private network for women executives and CEOs.","The museum's press release says the cracked glass is meant to represent Harris' breaking through the ""glass ceiling,"" a term that refers to the barriers women and minorities face when it comes to career advancement.","This will just be a wonderful visual emblem of this moment in time and hopefully people will reflect a little bit on all the barriers that have been broken by her election,"" Holly Hotchner, president and CEO of the National Women's History Museum, told the Associated Press, speaking of the portrait of Harris."
916,glass ceiling,"Representation matters, especially at the ballot box, and the inauguration of Kamala Harris as the first woman, and first woman of color, to serve as vice president of the United States is a landmark moment in American history,"" said Holly Hotchner, President and CEO of the National Women's History Museum.","Today's progress is built on the legacy of the women who came before – the trailblazers, like Kamala, who raised their voices, marched for their rights, and ran for elected office; the women who cracked glass ceilings so that other women could shatter them,"" Hotchner said.","It is a true honor to join BBH and Chief as partners in this remarkable installation honoring this critical turning point in the fight for representation, Vice President Harris, and the numerous women throughout history who demanded a seat at the table."""
917,glass ceiling,"There’s an adage, ‘You can’t be it if you can’t see it.’ I suggest to them, ‘Now you can see it,’” Ng said at a news conference in Miami on Nov. 16.",Seeing Ng break a glass ceiling that has been rigid for decades serves as proof that the seemingly improbable can become possible through the determination of incredible individuals.,"Just days removed from winning an SEC championship as goalkeeper for the Vanderbilt University women’s soccer team, Fuller became the first woman to play in a college football game for a Power Five conference as she suited up for Vanderbilt as kicker against the University of Missouri."
918,glass ceiling,"Three incredible and inspiring women — Kim Ng, Sarah Fuller and Stéphanie Frappart — all became trailblazers in their respective fields, paving the way for a more inclusive and exciting future for female athletes determined to tear down the patriarchal walls that have excluded women from the sports world.",The glass ceiling of women in the sports world has been slowly chipped away for years.,"With cracks showing from a promising 2020, the ceiling threatens to shatter in the near future, an exciting prospect as female athletes and executives attempt to level the playing field for generations to come."
919,glass ceiling,Installation by the National Women's History Museum can be seen in D.C. this week,"A glass portrait honoring Kamala Harris, unveiled in front of the Lincoln Memorial yesterday, symbolizes her achievement in shattering the ""glass ceiling"" by becoming the country's first female vice president.","The work is presented by the National Women's History Museum, together with Chief, a private network focused on connecting and supporting women leaders.The portrait itself is based on a color photo of Harris taken by photographer Celeste Sloman and was crafted by artist Simon Berger."
920,glass ceiling,The U.S. women’s national soccer team continues to outperform the country’s men’s team as they dominate competitions and find themselves as role models for a new generation of female athletes.,"In a year that has left many of us dejected and distressed, women breaking the glass ceiling in the sports world has provided me, along with many others across the globe, with hope for a brighter future.","Just a decade ago, women like Ng, Fuller and Frappart serving in their respective roles may have seemed ludicrous, but now, we admire and recognize their accomplishments."
921,glass ceiling,"Soni Mishra  By Soni Mishra February 06, 2021 13:41 IST","While there has been a marginal increase in the number of women in India's judicial system, the glass ceiling continues to be an obstacle in the way of achieving gender parity in the field, with women comprising only 29 per cent of the judges in the country.","According to the findings of the second edition of the India Justice Report brought out by the Tata Trusts, the overall representation of women has improved in 20 states at the level of subordinate court judges."
922,glass ceiling,"Kamala Devi Harris was sworn in as the 49th vice president of the US on Wednesday, becoming the first woman, first Black American and first person of Asian descent to hold the office.","Vice President Harris, the daughter of immigrants from Jamaica and India, shattered that major glass ceiling and then got right to work alongside President Biden.","The two have outlined an ambitious agenda to tackle the coronavirus pandemic, the economic recession, climate change and racial justice."
923,glass ceiling,"Lau read about Harris' parents, father Donald Harris from Jamaica and mother Shyamala Gopalan from India.","And then seeing her take that helm as the first woman to break that barrier,"" Lau said, ""It wasn't the final glass ceiling, but it was a glass ceiling that women have waited centuries to shatter.""",Lau is a senior at Norwich Free Academy and aspires to become a lawyer and a federal judge.
924,glass ceiling,"What Lapid needs is an achievement wholly credited to himself – clean, straightforward, impressive – even if it ends up being “just” 20 seats and not 25, and even if he won’t be the next prime minister.","In the long run, that’s his only route to the highest office, his only way of shattering the glass ceiling once and for all.",The cracks are already showing.
925,glass ceiling,"Shipping firms employ too few female seafarers, says ICS","In Scandinavia, the Mediterranean and Asian shipping companies, family ties often smooth the way for women to break through the glass ceiling.","However, it seems to be different in Germany."
926,glass ceiling,"It was funny because I didn't think that was possible until maybe in the next 20-30 years, and I didn't think any brown person would reach that level until I was old enough.","And so the fact that it's happened and she's done it and broken this amazing, ridiculous glass ceiling is awesome to see and just so, so exciting.",Not expected and so much more to do and she's now paved the way.
927,glass ceiling,"It is a true honor to join BBH and Chief as partners in this remarkable installation honoring this critical turning point in the fight for representation, Vice President Harris, and the numerous women throughout history who demanded a seat at the table.""","Chief's mission is to drive women into positions of power and keep them there – we exist to support ascendant women to break glass ceilings, retain their seats at the table, and create lines of succession for future women leaders,"" said Lindsay Kaplan, who co-founded Chief in 2019 with Carolyn Childers.","This artwork not only celebrates Vice President Kamala Harris, a woman who embodies this mission, but it recognizes the women who came before her and those who'll come after."
928,glass ceiling,A cracked-glass portrait of Kamala Harris has been unveiled at the Lincoln Memorial in DC.,"Artist Simon Berger used glass in the piece to represent Harris' role as a ""glass ceiling breaker.""","Second Gentleman Doug Emhoff called the installation ""incredible"" after seeing it in person."
