,MWE,Previous,Target,Next
2075,silver screen,"The annual TCM Big Screen Classics series begins Sunday, Jan. 24 with an 80th anniversary presentation of ""The Maltese Falcon.""","The Ten Commandments,"" ""Citizen Kane,"" ""The African Queen,"" and ""Willy Wonka & the Chocolate Factory"" are also scheduled to return to the silver screen this year.",Fathom Events says each film will play two days — usually Sundays and Wednesdays — twice a day.
2076,silver screen,"Sets around the world were shut down in the spring, as were theaters.","Countless projects have been pushed back as a result, for both the small and silver screen.","But nevertheless Awards Season has arrived, with 2021 Golden Globe nominations honoring the very best the industry has to offer."
2077,silver screen,"So while there are few films from them, there are a great number about them.","Generation Z actors grace the silver screen, though they move through pictures of generations X and Y.",Marketing studies are taking an intense look at the general social trends developing in Generation Z.
2078,silver screen,"The Fictitious Athlete Hall of Fame named its class of 2014, and Reggie Dunlop and the Hanson Brothers didn’t make the cut.",We count down the five best hockey players from the silver screen.,Where do the greatest movie athletes go when they retire?
2079,silver screen,Silver was always going to be next.,"The Gamestop traders dropped a big enough hint, driving up the shares of cinema chain AMC Entertainment, home of the silver screen.",The biggest beneficiaries of that?
2080,silver screen,But that did not work well for him.,"Now, there were rumours that SRK will make his return to the silver screen with Pathan.","Well, Deepika Padukone just confirmed the news."
2081,silver screen,"Having just launched the Galaxy S21 internationally with pre-orders happening already ongoing in Malaysia, the company is looking to launch the Galaxy S21 series with a bang; albeit a little differently.",The Galaxy S21 series will be making its official Malaysian debut on the silver screen.,Samsung Malaysia is partnering with local broadcast companies Media Prima and Astro.
2082,silver screen,Waheeda Rehman Birthday: Interesting facts about actress who added luminescence to silver screen,Veteran actress Waheeda Rehman who added luminescence to the silver screen with her stellar acting and charm celebrates her 83rd birthday today.,As one of Bollywood’s most loved yesteryear stars turns a year older let us delve into some lesser-known facts about her life.
2083,silver screen,"Instead, baseball's film greats received induction, as Crash Davis, Ricky ""Wild Thing"" Vaughn, Roy Hobbs, and, as a contributor, announcer Harry Doyle all make their way into the fictitious Hall.","Left out in the cold are several of hockey's greatest players from the silver screen including Reggie Dunlop, the Hanson Brothers, and Gordon Bombay.","While the premise is (admittedly) ridiculous, it got us to thinking: who are the greatest fictitious hockey players of all-time?"
2084,silver screen,Many of his plays were brought to Broadway with great success.,"Additionally, Sutro adapted several for the silver screen.",There will be a live audience talk-back after the production where the cast will take questions from the audience.
2085,silver screen,"With that in mind, the staff at The Garden Island offers up movies that have inspired them, and hopes that perhaps one day when you’re in need of motivation, encouragement or faith in yourself, these flicks might surprise you.","Growing up in the San Francisco Bay Area, there are Filipinos everywhere — just not on TV or the silver screen.","The only Filipino-based entertainment I’ve seen growing up were the, at times, overly-theatric TV dramas my mother would watch on The Filipino Channel or the bootleg movies her family from P.I."
2086,silver screen,The ministry of information & broadcasting has stated that said that the cinema halls and multiplexes are now allowed to show films with 100% seating capacity.,This news has definitely brought a big smile to the faces of cinema-goers as now they will be able to watch their favorite stars on the silver screen once again.,Akshay Kumar's much-awaited film 'Sooryavanshi' and Salman Khan's 'Radhe – Your Most Wanted Bhai' is among the initial ones slated to hit the big screen.
2089,crash course,"Minteer, an assistant professor of entomology at the University of Florida's Institute of Food and Agricultural Science Indian River Research and Education Center in Fort Pierce, now works alongside creepy crawlers full time trying to use insects as a natural combat to Florida's invasive plants.","Residents can get a crash course into Minteer's research on Saturday when the Vero Beach scientist will be featured on CBS' ""Mission Unstoppable"" — a television series that highlights women in the science, technology, engineering and mathematics field to inspire the younger generation.","It was a phenomenal experience,"" Minteer said."
2090,crash course,"Now, as the pandemic has caused a backlog of jury trials and with some proceedings being held virtually, things are even more complicated.","Since I’m still learning the ropes myself, I asked District Attorney Dan Itzen to give me a crash course on the court system this week, and this is what I learned.","If you’re arrested for a misdemeanor and your case is sent to circuit court, your initial appearance in front of a judge takes place at 2 p.m. the next day (except, of course, if it’s a weekend or holiday — even justice needs time off)."
2091,crash course,"Ezarik has her eye on rollable phones, and advances in tech that allow more nontech users to connect.","This past year, we all got a crash course in Zoom and other videoconferencingsoftware, and she hopes that people continue to embrace new ways of connecting.","I don’t think that [things] are going to return to what we know,” she says, commenting on this past year of quarantine and distancing, so she hopes that leads to even more growth in using tech to keep us connected."
2092,crash course,"In my first session with Lauren, it became abundantly clear how lost I was and how I was about to go down that familiar wrong path again.","It threw me for a loop when my dietitian gave me the opposite advice as the doctor who diagnosed me: Cutting out carbs would just be a quick fix for a much larger issue, but what I really needed was a crash course on eating.",It weighed heavily on me trying to decide whether to listen to my doctor or my dietitian.
2093,crash course,"Nevertheless, their activities online are likely to define a lot of what we remember 2021 for, as has increasingly been the case in recent years.",So to give you a crash course in which producers to keep an eye on over the next 12 months — especially as we wait for the government to roll out its vaccination program — here’s a collection of some of influential Japanese creators who are poised to shape 2021.,Haruka Fuwa had a massive year in 2020.
2094,crash course,The first impeachment process asked the founders’ intent in the words “high crimes and misdemeanors” and ensued a debate over the Justice Department policy that a president is inherently constitutionally incapable of being prosecuted.,"The 2020 fall election stimulated a crash course in the Electoral College, its fairness, the meaning of “faithless electors” and “alternative slates.”",Fealty to these principles makes us great
2095,crash course,"Not only does Knighton say we need more people to follow prevention guidelines—for those who do, she wants to see messaging on how to do things like wear a mask and how to wash hands properly.",We’ve given America a crash course in infection prevention overnight.,"They’re being told what to do but they’re not being told how to do it and why they should do it and I think that is the part that has been missing,” said Knighton."
2096,crash course,Tina Boyd was still unsure about what kind of law she wanted to practice when she landed a position as a law clerk for Berks County Judge Elizabeth Ehrlich more than two decades ago.,"She received a crash course in family law, and quickly found that she had a passion for it.","When I started working for Judge Ehrlich I witnessed her dedication and saw the love that she had for her job,"" she said."
2097,crash course,"In particular, he credits the Transparent Collective, a nonprofit that helps underrepresented founders understand the culture of Silicon Valley and secure funding.","Run by serial entrepreneur James Norman, the Transparent Collective funded a flight to the Bay Area, where they gave Dedner a crash course on Silicon Valley culture.","If Hurdle is successful, it could change Silicon Vallley culture"
2098,crash course,"Before Exams, Crash Course For Karnataka SSLC Students ",Karnataka to give crash course for SSLC students before exams,"Karnataka's Primary and Secondary Education Minister S. Suresh Kumar on Sunday said that Class 10 students from the state will be given a crash course for a week before the SSLC or Class 10 annual examination, The Hindu reported."
2099,crash course,"I was trying to finish a master's degree and juggling three kids and a granddad that I'm trying to keep safe,"" Saridakis Bean said.",The two recently wrapped up a crash course on how to run for political office.,"Dennis Grady, the CEO of the Chamber of Commerce of the Palm Beaches, said the class addresses key concepts."
2100,crash course,"I've learned so many things,"" she said.",2020 was a year that was a crash course in all kinds of things that I didn't know — and I'm continuing to learn.,"You continue to learn more and more every year that you stay on the council."""
2101,crash course,Associate Degree in Nursing (ADN) Program students and their instructor Melissa Guidry as well as some of our Bachelor of Science in Nursing (BSN) Program students assisted the Laredo Fire Department with a,Pandemic is a crash course for LC nursing students,"After hearing Laredo College Licensed Vocational Nursing program received a favorable review from a nursing website, Dean of Health Sciences Dr. Dianna Miller and Vocational Nursing Instructor Tracy Humphries reflected on the success of their students and the challenges and opportunities faced amid the COVID-19 pandemic."
2102,crash course,And it was good to observe that the team that did less cheating was the team that won.,"So, if you are feeling guilty for having spent the entire Sunday watching Super Bowl LV, take solace in the fact that you were getting a first-rate adult education crash course in social studies.","America is the land of the free, home of the brave and filled with those who love commercials and embrace weekend spectacles."
2103,crash course,"The NFCSD did not run into delays starting the school year as some other districts did because we had a comprehensive, rigorous plan to train our teachers well in advance of September.",The “crash course” in distance learning that evolved out the pandemic fast forwarded the inevitable – technology-based learning is here to stay.,Continuous professional development and support will keep the NFCSD stationed at the head of the class when it comes to technology.
2108,blind alley,The ultimatum served the herders in Ondo State and the attack on their leaders in Oyo are both symptomatic of the inevitable result of pushing the people to the wall.,"The elders say when you chase a goat to a blind alley, it will turn and face you.","Ondo State governor, Rotimi Akeredolu(SAN), is a die-hard Buhari supporter and is not known to be a frivolous person."
2109,blind alley,"Another key pillar of Amazon's culture is the ""blind alley"" approach to innovation.","The thinking goes that you reach a dead end when ideas fail, but if customers embrace a new way of doing things, the blind alley opens up into a ""huge, broad avenue.""",The theory is based on Bezos' overarching belief in paying attention to what customers want rather than what everyone else is doing.
2110,blind alley,"For the first hour, I couldn't stop watching it bump into the furniture.","At one point it disappeared under an end table before eventually finding its way back out, like a drunk stumbling out of a blind alley.",The packaging says the Shark uses internal algorithms to chart its course.
2111,blind alley,"In a statement on Thursday, the SACM maintained the PDM’s meeting will produce nothing adding that time has come when the three leading characters will bury this so-called alliance because the thieves are finding it difficult to find an escape route.","The looting cabal is entrapped in a blind alley with no escape route, she added.","Meanwhile, the bondmaids are also wailing around to defend the political thieves."
2112,blind alley,Other youths also threw stones at the vehicle.,"The driver who was alarmed by the attack, turned into a nearby alley and noticing that it was a blind alley, got out of his car and fled the scene on foot.","The prosecution has asked that four of the boys, ages 15-16, be detained by police until the trial begins."
2113,blind alley,"The three-minute pursuit saw Khan take a blind bend on the wrong side of the road, cut-up a vehicle on a roundabout and speed up aggressively behind a motorist waiting to turn right.","He turned down a blind alley off Willow Street, jumped out the car and ran off.","Khan was caught and arrested, later telling the police he had borrowed his father's car and panicked when he saw the patrol vehicle behind him because he knew he was unlicensed and uninsured."
2114,blind alley,"Or, as he put it in 2004, ""if you're watching your competitors, you're unlikely to invent a bunch of stuff on your own.""","While the ""blind alley"" strategy has seen some failures, such as the Amazon Fire smartphone that lasted for one year and is believed to have cost the company $170 million, it's also seen some huge rewards, such as Amazon Web Services, the signature cloud computing platform that made in excess of $25 billion in 2018 alone.",Maintaining a 'day one' mindset
2115,blind alley,Only by fully appreciating the strategic importance of Egypt for Italy can we understand why Italian governments have lagged so far behind the extraordinary efforts of the Italian judiciary in pursuing truth and justice for Giulio Regeni.,"With decades of successive governments in power for just a few months, prey to the whims of minority parties, Italy has backed itself into the diplomatic blind alley it today finds itself in.","Fearful of taking forceful action on its own, at times overshadowed by France, and abandoned by a divided Europe, Rome has navigated the Regeni inquiry paralyzed by the fear of compromising its fragile position in the Mediterranean."
2116,blind alley,Can a worker in the Middle East know “how to conduct the struggle he is involved in” without studying the historical role of bourgeois nationalism and the significance of Trotsky’s Theory of Permanent Revolution?,How can the advanced sections of the Israeli working class find a way out of the blind alley of Jewish nationalism without understanding the origins and nature of Zionism?,To state the issue as precisely as possible: the “nature” of any given struggle can only be understood when placed in the necessary historical context.
2117,blind alley,"Like everybody else nowadays, Mr. Cahill sees through the ""fatal facility"" of Sargent; on the other hand he is not intinridated by the pretensions of modernism.","There is no health in introspection,"" he wisely says; ""the cultivation of sensibility has become a blind alley.""","He recognizes that present interest in the Mexicans and mural painting generally has a psychological or sociological cause: ""The one clear note in contemporary American painting is a new emphasis upon social and collective expression."
2118,blind alley,"The “New Deal,” despite its first period of pretentious resoluteness, represents but a special form of political perplexity, possible only in a country where the bourgeoisie succeeded in accumulating incalculable wealth.","The present crisis, far from having run its full course, has already succeeded in showing that “New Deal” politics, like Popular Front politics in France, opens no new exit from the economic blind alley.",International relations present no better picture.
2119,blind alley,"It means to attribute an ontological status of objective existence to something that is, inevitably, a socially shared form of discourse to refer to a highly subjective experience.","Ultimately, it represents a blind alley that only leads to irrelevant or misguided results.","From a constructivist and discursive position, approaching psychological processes always entails approaching a form of social or personal construction of these processes."
2120,blind alley,"In contrast, hundreds of millions of people throughout the globe will have to accept that at the moment they have, or it would be more honest to say, don’t have access to clean water, food, education and other benefits of civilization,"" he said.","This archaism is a blind alley, it is a road to new conflicts,"" the Russian leader pointed out.","According to him, ""the migration crisis in Europe and in the US stems from this""."
2121,blind alley,"Because of this we are able to provide targeted and effective programming to these students to move them from where they are in their learning to where they need to be,"" Perry said.","Without her work, it would be as if we were searching in a blind alley to find the right path for our students.","Lisa's work shines a light and helps guide the way forward,"" she said."
2122,blind alley,"Secondly, because of its federative character, the agitation has so far not thrown up any leadership that could be a symbol around which masses may gather.","Third, the stubbornness of the leadership about withdrawal of farm laws has already landed it into a blind alley.","Having brought huge numbers on Delhi borders, the agitation has literally nowhere to go."
2123,blind alley,Modi Govt pushed India into a blind alley by its unlawful steps in occupied Kashmir: FO,Foreign Office Spokesperson Dr Muhammad Faisal says Indian government has led India to a blind alley.,"Talking to PTV on Friday, he said even international media has to say that eight million people are detained in their homes in Indian occupied Jammu and Kashmir."
2124,blind alley,"He has used the alliance’s umbrella to his advantage, obtaining bail in a corruption case and is now trying to get the case transferred to Karachi.”",He said the opposition had not only been wasting the nation’s time for the last four months but had also strayed into a blind alley.,The alliance will unravel if Maryam Nawaz is allowed to go abroad.”
2125,blind alley,He said this shows they have no consensus and strategy.,He said the opposition parties have taken themselves to the blind alley in their lust for power and to save themselves from accountability.,The Information Minister said the public gatherings of the opposition also demonstrate their indifference to the health and lives of the people.
2126,blind alley,It is an absolute necessity.,Months of determined probing by the FBI's scientists and investigative staff had led merely to one blind alley after another.,"Yet, the relentless search to identify the person who had brought the hollow nickel to New York, as well as the person for whom the coded message was intended, continued."
2127,blind alley,So US stocks are not expensive relative to bonds.,"Secondly, the tech boom of the late 1990s subsequently proved to be not a blind alley but the overture to a technology revolution.",As MoneyWeek’s Dominic Frisby points out: “manias almost always accompany new technologies.”
2128,blind alley,Opportunity can be evaluated only in terms of personal capacity.,What is opportunity for one young man is a blind alley for another.,"In rapidly expanding pioneer communities, openings for capabilities of all sorts automatically appeared."
2129,blind alley,"Timo Werner, who cost £48m from RB Leipzig in the summer, distilled the essence of Chelsea this season in one performance against Luton.","He set up Abraham’s first goal and had a brief, coruscating period before wandering down the blind alley of anonymity.",He emerged again when Abraham scored the third and the Premier League side were back on show-offy top to produce an almost comic cameo where he missed a sitter and a penalty.
2130,speed trap,Receiving a citation in this situation is similar to being a crime victim because I have no recourse.,Law enforcement psychologist believe that speed traps (and similar officially sanctioned shady behavior) encourage officers to feel that their supervisors condone pushing the limits of their position and can lead to the use of excessive force by officers.,"Simply stated, citizens believe that their law enforcement leadership should set a forthright and moral example and a county that condones a known speed trap sets a very poor example indeed."
2131,speed trap,"But when Brian McCrary, 33, received a speeding ticket in Bluff City, Tennessee, he didn't just complain, he bought the local police department's website and used it to complain.","After receiving a $90 speeding ticket earlier this year for cruising through what he called a speed trap, McCrary went to the Bluff City Police Department's website to reschedule his hearing.","When he saw that the site's content had been replaced with a notice saying that the domain name was on the verge of expiring, he saw an opportunity."
2132,speed trap,"As you drive, the app updates its traffic reports, and if a major problem ensues, Waze will even suggest alternative routes.","And, if there is a problem along the way – like a speed trap – Waze will let you know where to slow down!","It sounds like Waze employs a fleet of traffic experts who are constantly on patrol to bring you the latest traffic news – but actually, the Waze people don't do much more than maintain the app and the Waze servers, which provide the navigation information (automatically, of course)."
2133,speed trap,Law enforcement psychologist believe that speed traps (and similar officially sanctioned shady behavior) encourage officers to feel that their supervisors condone pushing the limits of their position and can lead to the use of excessive force by officers.,"Simply stated, citizens believe that their law enforcement leadership should set a forthright and moral example and a county that condones a known speed trap sets a very poor example indeed.","As a Summit Daily News reader, you make our work possible."
2134,speed trap,"He also admitted that the camera was adjusted to only capture motorists travelling at 60mph or above to allow office staff to keep up with the large number of prosecutions generated by the camera, which has since been removed.",More motorists caught by the speed trap in April last year are due to appear in court next week.,"In an ironic twist, several of the motorists returned to their cars after yesterday's hearing to find they had received parking tickets."
2135,speed trap,"The hybrid vehicles start under battery power, and that battery is recharged by the engine as necessary, Ryan explained.","As a result, when police park and idle somewhere for something like a speed trap, the idling engine turns off and the car stays active on electric power only.","Ford says each unit saves about 1,300 gallons of fuel a year,"" Ryan said, putting the impact of that at about $3,500 per vehicle."
2136,speed trap,My family has vacationed in Summit County in both winter and summer for the past 15 years and happily pay the housing and sales taxes but we choose to pay these taxes because we want to visit a beautiful place.,A speed trap is unethically extracting money from someone because the victim has no power.,Receiving a citation in this situation is similar to being a crime victim because I have no recourse.
2137,speed trap,But I don't think that's a problem anymore.'',"Even if the speed trap issue is overblown, the legislative committee did seem a bit peeved about the city's credit cards being used haphazardly, as well as bills at the local convenience store topping more than $100,000 in recent years.","Nepotism seemed to be another issue, and the city had a small problem with bouncing checks."
2138,speed trap,"Mr White said: ""I have recently witnessed a speed trap on the Cheltenham Road right at the end of the road near the roundabout.",On both sightings the speed trap was hidden from view until you were right on top of it.,"I do not condone speeding and although the trap has not personally caught me, I feel this sneaky behaviour should be brought to people's attention."
2139,speed trap,Plummer says she never imagined what's happened to her over the last two weeks.,She says she took a stand to warn drivers about a speed trap and is now receiving an outpouring of support from around the country.,Plummer's Facebook page continues to light up with more likes after her controversial arrest by two Houston police officers.
2140,speed trap,"On June 21, Plummer says she was holding a sign on the sidewalk, warning drivers of a speed trap ahead.","The HPD officer running the speed trap became furious and arrested her, she says, for holding the sign.","He stated multiple times that he was taking me to jail because of that sign and to teach me a lesson,"" said Plummer."
2141,speed trap,He claims the officer was out of sight for drivers and wanted to bring the matter to public attention.,"Mr White said: ""I have recently witnessed a speed trap on the Cheltenham Road right at the end of the road near the roundabout.",On both sightings the speed trap was hidden from view until you were right on top of it.
