,MWE,Previous,Target,Next
2894,kangaroo court,"Is he supposed to pretend that he agrees with a decision, when he doesn't?","To dock his pay for 30 days in this kind of ludicrous kangaroo court would be a terrible thing for Wilmot, for three reasons.","One, it would be an unjust decision, made on dubious grounds."
2895,kangaroo court,Was there any cross examination?,"If this is a court of law, what distinguishes a kangaroo court, is there's no cross examination.","And if there is a cross examination, Republicans say, that would undermine some of what Taylor is saying here."
2897,head hunter,"But after a couple of years, the money was running out.",It was around this time that Mary was approached by a head hunter who offered her a mysterious job that required top secret clearance.,"He told her she'd be doing ""a little of this, a little of that""."
2898,head hunter,Gwyneth Paltrow delights fans with rare family photo to mark special occasion,Private equity funds pick head hunter Egon Zehnder to find Serie A media boss - sources,Emmerdale star Emma Atkins hints at Charity wanting revenge against Al
2899,head hunter,He was there for six years before becoming chief operating officer of Morton Plant Mease North Bay Hospital in New Port Richey.,"When he got the call from a head hunter about the open CEO job at Tampa General, it was a no-brainer, Couris said.","To lead a hospital like Tampa General, which has such a rich history and is one of the largest and most respected institutions in the region, is a privilege and an honor,"" he said."
2900,head hunter,The causes and consequences of extreme economic inequality is being studied from a range of considerations.,"One aspect of the work has involved the role of executive search firms, or head hunters, in high CEO remuneration in large firms in the United Kingdom.","The findings, presented in the article ""Head- hunter methods for CEO selection"" (full reference below), led to two articles in  The Financial Times   and prime coverage in the  Sunday Observer."
2901,head hunter,"She has one sister, Diana; and one half-brother, Charles, from Bronda's second marriage.","Liz Astor worked as a model and a head hunter before her marriage to Baron Astor. Astor has written two books, a memoir and a novel.",Loving Olivia: Bringing Up My Autistic Daughter recounts her experience with younger daughter Olivia's autism.
2902,head hunter,"The next day, Grace Makutsi seeks a new job, having the name of an employment agency in hand.","She is startled to meet her nemesis, Violet Sephotho, as the “head hunter” looking to fill positions for experienced secretaries.","There is no chance of a good position from her sarcastic, one-time classmate, which gives Grace Makutsi a moment to realize how much she likes her work at the Detective Agency."
2903,head hunter,Headway started in Leeds and added a Bradford office on Duke Street in 1988.,Managing director Mark Gill joined the family business 11 years ago after working for a global recruitment group followed by a stint as a corporate head hunter.,"Since taking over the reins, Mark has set about modernising the business to keep Headway up to speed with current trends to drive the business forward."
2904,head hunter,"While trying to buy a Chicago-based money management firm, Larson received a call from a head hunter to work for Bill Gates.","The head hunter had heard of Larson from a few investors in Tacoma, Washington.","In 1994, Larson and his wife moved to Seattle."
2905,head hunter,"I had to find a man to replace Eustace Smith, and was fortunate in picking up Joe Thomson at Campbell River, and two better men than Smith and Thomson I could not have had.",Smith was to act as head hunter and guide and Thomson more particularly look after the cooking and camp generally.,Thomson came on board with me and we picked up Smith at Quitiaski Cove at about 4 a.m.
2906,head hunter,Vrablic grew up in the Bronx and then the New York City suburb of Scarsdale and started out as a bank teller before eventually landing a job analyzing proposed loans.,"In 1989, a head hunter recruited her for a job in Citicorp’s private-­banking arm.","Citi was widening its suite of offerings to such clients, including by making loans to finance their big real estate projects."
2912,head hunter,"Taylor is currently unranked by all major recruiting services, but held offers from Illinois, Kansas, Maryland, Minnesota, Missouri, Syracuse and Vanderbilt at the time of his commitment to Arizona.","I am a physical, fast, strong head hunter that can make plays all over the field and play any position,"" Taylor said in an interview with 247Sports' Jason Sheer.",I am versatile and ready for what the future holds for me.
2913,head hunter,Here’s what the newspaper’s Safid Deen wrote about Nasirildeen: “A freakish athlete who could thrive in the box and against tight ends at the NFL level.,He’s a head hunter and plays with aggression when he comes downhill to make tackles.,His length and speed allows him to stay tight in coverage and allows him to make plays on the ball as well.”
2914,head hunter,We were hit by the bullets; the bullets were extracted by traditionalists.,The head hunter assisted to remove the bullets.”,"The traditional ruler of Ayete, Oba Emmanuel Okeniyi, had earlier told our correspondent that farmers fled the settlement for fear of being attacked."
2915,head hunter,"So, everyone had been avoiding any rapport or relationship with them in that axis until they grew in numbers and started sending people away.""",He said the intervention of Olori-ode (head hunter) who helped to extract the bullet before my son saved his life before it could cause more damage.,"Also speaking on the situation, a resident of Ayete said the crisis began some days ago when a Fulani herdsman, Iskilu Wakili, was asked to leave the village because he did not buy the land he was occupying."
2916,head hunter,"He could mount, drive their beasts before him into the plain, and then return to camp.",No need of explaining his absence; he was the head hunter of the expedition; it was his business to wander.,"All this was so easy to do, if he could only take the first step."
2917,peace talk,"No doubt, radical jihadists need to be confronted forcefully, but I wonder if the answer to the world's problems is more war talk.","Maybe what we need is more ""peace talk"" between thoughtful people able to ask ""stupid questions.""","Since the bombing in France there have been other incidents, including horrific violence in Nigeria where 2,000 souls have perished at the hands of Boko Haram, the Saudi Arabian blogger Raif Badawi flogged for daring to speak his mind about the country's conservatism, American journalists beheaded, a Jordanian pilot was burned alive and millions of people continually displaced by war and violence."
2918,peace talk,"That makes his selection a hard choice for those hoping to see the resumption of the stalled peace and reconciliation process between the Taliban and the Afghan government under the platform of the Quadrilateral Coordination Group (QCG), comprising Afghanistan, Pakistan, China, and the United States.","Since December of 2015, the four countries have held several meetings to pave the way for launching direct peace talks between the Taliban and the Afghan government.","Akhundzada's personal views aside, the launch of peace negotiations, at least in the near future, also seems improbable given that the trust level between the warring sides is now at its lowest ebb."
2919,peace talk,The film was originally going to be a prequel where the principal characters would all meet; another draft of the script was exceedingly dark and had all of the characters being killed off except for Spock and McCoy.,The plot of the film revolves around a Klingon peace talk with the Federation which a nefarious and shadowy faction is attempting to sabotage through subterfuge and assassination.,"Kirk, Spock, McCoy, Uhura and all the rest of the original Enterprise crew are tasked with finding the devious culprits and putting an end to their madness."
2920,peace talk,River Seine floods in Paris with Eiffel Tower in background,"In an ironic twist of fate, the same Friday that the international conference of the French initiative to force peace talks on Israel was launched in Paris, floodwaters in the capital city reached peak levels in what has been declared as a natural disaster.","The River Seine in Paris is set to reach six meters (19 feet) above its normal levels on Friday, causing the prestigious Louvre and Orsay museums to close as staff anxiously rushes to move famous artworks out of the flood path."
2921,peace talk,"Iran voices concern about deadly attacks in Afghanistan, offers help in negotiations","Afghanistan and Taliban peace talk negotiators will hold their first direct session on Tuesday in Doha, officials said, as the warring sides try to work out an agenda and schedule for how to negotiate a peace deal as the United States withdraws troops.",A small group of negotiators from both sides had met in previous days to try to discuss how the substantive negotiations would take place.
2922,peace talk,"Opponents call it a dangerous, irresponsible gambit that would benefit an assortment of opportunistic politicians eager to grab a share in power.","The only way to break the current deadlock is to form an interim government,"" said Jafar Mahdavi, a former legislator who is involved in the peace talks process.","The Taliban won't accept Ghani's rule, and they won't join his government."""
2923,peace talk,"At the same time, talks between the Afghan government and the Taliban are making little headway.","At the end of April, “these peace talks won’t be over,” German Foreign Minister Heiko Maas said at an event organized by weekly Die Zeit and three other German newspapers.",Our fear is that the Taliban could use this as a reason to leave the peace talks and seek a military solution.”
2924,peace talk,"Baradar, a founder of the Taliban movement, spent eight years in prison in Pakistan but was released in 2018, at the United States' request, to participate in the peace process.",The role of Pakistan in the peace talk process has taken on sudden new importance in the past several weeks.,The country has long said it supports the talks and seeks a stable Afghanistan.
2925,peace talk,Russia puts jailed Kremlin critic Navalny's spokeswoman under house arrest,Terrorist attacks are being continuously reported Afganistan amid the peace talk.,"In a new incident,  at least two soldiers were injured in an explosion in Afghanistan's Kabul on Tuesday morning., no terrorist group has claimed responsibility for the attack."
2926,peace talk,"U.S. President Donald Trump has made ending the war in Afghanistan a key election promise and the United States is set to withdraw all its troops by May 2021, subject to the Taliban meeting certain security guarantees.",Afghanistan: The road to peace talks,"Trump to announce further US troop withdrawals from Iraq, Afghanistan"
2927,peace talk,He first led the Alligator Forces of 100 men and later a battalion on 400 rebels.,He even accompanied the group's founder Foday Sankoh to the a peace talk in Cote d'Ivoire in 1996.,The 2000 UN Panel of Experts report cited him as the fourth man in command of the faction.
2928,peace talk,"Trump to announce further US troop withdrawals from Iraq, Afghanistan",Afghanistan frees nearly 200 Taliban prisoners to push peace talks,"Iran voices concern about deadly attacks in Afghanistan, offers help in negotiations"
2929,peace talk,"Yes, that would be amicable.",She could have mediated a Cold War peace talk.,"The mood eased and the clouds cleared (just kidding, it’s January; the clouds never clear)."
2930,peace talk,"Historically Afghanistan has reached a critical juncture, although the recent peace process formed hopes to an ending and prolonged peace, and reduction in violence.","Despite efforts for peace violence raged and surged, and many journalists, civil society activists were killed, which raised serious concerns over peace talk success and whether core values of freedom of expression, speech and civil liberties be protected, the statement added.","This comes as NATO Secretary-General Jens Stoltenberg in a joint press conference said  “we have seen attacks … against individuals, journalists, and others, and of course the high level of violence is something which is of great concern.”"
2931,peace talk,"We tried to sit and talk with India on the long-overdue matters for resolution and find a solution for the Kashmir issue but despite my attempts, I could not understand why India wasn’t willing to talk, said the prime minister.","When I offered a peace talk, in the beginning, I could not comprehend why my counterpart Modi was not willing for dialogues, but only after the Pulwama fiasco followed with our trees being martyred in Balakot, I realized that India was pinning its election campaign on hatred against Pakistan, said PM Imran Khan.","I once again reiterate my dialogue offer to Modi while reminding him there’s no other way, he said."
2932,peace talk,Foodie groups are back on track to explore Delhi-NCR,N’Delta militant groups back out of FG’s peace talk,Covid vaccine passport plans cause global unease
2933,peace talk,"CHRIS THURMAN: Food that takes patrons on a journey, morsel by morsel",US plans to slap terrorist label on Yemen’s Houthi group raises peace talk fears,Decision to blacklist the Iran-aligned group comes as Joe Biden prepares to take over from Trump
2934,peace talk,"In the face of all this, tension rose to fever pitch levels in the country.","But amid all of that, a peace talk held.","The federal government, which tried at first to arm-twist Akeredolu, was said to be behind the peace meeting between Miyetti Allah and South West governors."
2935,peace talk,"The Taliban won't accept Ghani's rule, and they won't join his government.""",Ghani has repeatedly insisted that he will remain in office for his full five- year term and see the peace talks to fruition.,"But a new round of negotiations, which have made almost no headway since they started in September, stalled this week, as two of the top Taliban negotiators failed to return to the talks in Qatar after visiting Pakistan for consultations."
2936,peace talk,"Mansour’s visits to Iran and his possible relations with the clerical’s establishment, though maybe a smart move on his part, was equally perturbing for his Pakistani backers.",It is believed that the slain Taliban chief had used his Iranian connections to ward off pressure from Pakistan regarding peace talks with the Afghan government in the past.,"Although the exact nature of Mansour’s contacts with Iranian establishment is not known, given the nature of Pakistan-Iran diplomatic relations, his frequent visits to that country must have been a source of concern for his Pakistani handlers."
2937,peace talk,The UN World Food Programme temporarily suspended air drops to Deir al-Zor because of the new heavy fighting there.,"Meanwhile, preparations are underway for peace talks backed by Russia and Turkey in Kazakhstan on January the 23rd, negotiations that Syrian rebel groups have now decided to attend.",The Russia Foreign Minister claims some Western countries who feel left out may try to undermine the talks.
2938,peace talk,when the Reaffirmists (Sison faction) opposed the former’s urban insurrection campaign?,"Sison denounced the use of Sparrow killing machines then but now he is shifting to this tactic, while pushing his peace talk overtures once again.","To keen observers of this 52-year insurgency, this shift in paradigm is a telltale sign that indeed, with his party quickly crumbling, Sison is left with no other option but to swallow his pride and take the bitter pill."
2939,peace talk,An Afghan presidential palace official said a top priority was getting the Taliban to agree on a ceasefire or significant reduction in violence.,Violence has continued in the country even after the launch of historic peace talks at an opening ceremony in Doha on Saturday.,"Talks between the two sides were to begin shortly after a U.S.-Taliban agreement in February, but started only after months of delays, caused in part by continuing Taliban offensives in the war-torn country as well as disagreement over the release of prisoners."
2940,peace talk,"The RNDA in an electronic statement on Tuesday by its Coordinator, ‘Major General’ John Mark Ezonbi, also warned foreign oil vessels to steer clear of the Niger Delta region or face dire consequences.","The peace talks between the RNDA and the Federal Government, which was initiated last year by the Deputy Senate President, Senator Ovie Omo-Agege, was allegedly threatened recently by the appointment of Mr. Effiong Akwa as the Sole administrator for the Niger Delta Development Commission (NDDC).","An alleged non-recognition of the Niger Delta region in the policy statements made by President Muhammadu Buhari during the January 1, 2021 broadcast to the nation is also another reason for the withdrawal."
2941,peace talk,"A Saudi Arabia-led military coalition intervened in Yemen in 2015, backing government forces fighting the Houthi group.",UN officials are trying to revive peace talks to end the war as the country’s suffering is also worsened by an economic and currency collapse and the Covid-19 pandemic.,"The UN describes Yemen as the world’s largest humanitarian crisis, with 80% of its people in need of help."
2942,peace talk,"Pakistan’s strategic location is vital for geopolitical leverage and also remains significantfor regional peace, particularly in Afghanistan.",There appears no doubt that the Taliban peace talk process owes a big role to be played by Pakistan.,"The Afghan peace stability including the ongoing Kashmir problem and Pakistan-India tensions; and the future of regional stability, all seem the core US concerns under the Biden administration.Admittedly, the top U.S. officials in both the democratic and Republican Governments have been praising Pakistan for its ongoing cooperation in the Taliban-peace talks."
2943,peace talk,"Leading the pack red-tagged by the CPP website was Compatriots, the underground mass organization of the CPP that runs Migrante, an open mass organization of Filipino migrants.","The Christians for National Liberation (CNL), which is the underground organization running all church-based organizations like Rural Missionaries of the Philippines (RMP) etc., co-hosted the forum with the following speakers: bogus professor Jose Ma Sison (bogus because he does not have any credentials to show he is a professor, according to DepEd); and bogus senior adviser of the peace panel Luis Jalandoni and Sister Coni Ledesma (both bogus peace panelists as there are no peace talks to speak of).","Surprisingly, none of the Makabayan’s political wannabes spoke, careful of course of being dragged deeper into CPP red net."
2944,peace talk,"Madeshi, Janajaties, conflict victims) is a key to make peace process a success.","Figure 1: Women's qualitative and informed participation in possible peace structures  If I examine the physical involvement of women in the negotiation and peace talk team and nominated list of  facilitators in the paste, it is quite discouraging.",No single woman was assigned or trusted to be the  facilitator.
2949,rat run,"A pedestrian mall is a street for people, meaning you can still walk, cycle, scooter or park on Korikori Green, but through vehicle access would be restricted, except when events are taking place in the park and surrounding areas.","When constructed it was anticipated that Korikori Green would be a ‘park lane’ to service the park and not expected to operate as a key link, or become a rat run, in the road network,” says Robyn Denton, City Transportation Operations Team Leader.","To restrict through traffic, we need to declare a section of Korikori Green a pedestrian mall under the Local Government Act 1974."
2950,rat run,"While responsibility for the regeneration project largely lies with Limerick County Council, it is understood that Housing Minister Daragh O’Brien, and Junior Minister Peter Burke, who as a delegated function responsible for local government, were not made aware that Ryan was minded not to sign off on the road.","Ryan said Moyross would not become a “rat run”, saying “certainly not under my watch”.","The minister said he looking at the overall plan for the regeneration of Limerick, and wants the area to have the “most modern and advanced transport system” which will bring investment and jobs."
2951,rat run,"A spokesperson for Cumbria County Council said: ""These resurfacing works are essential maintenance works and we have worked hard to put in place diversions that are safe and best placed for managing the traffic while this work is carried out.",It is very disappointing that there are a number of drivers locally not using the official diversions and as such are using local villages like Great Broughton as rat runs.,"We would ask all drivers to follow the clearly signed and approved diversions and help us keep our residents, communities and other drivers safe while this work is carried out."""
2952,rat run,"As a result, Nationwide had a meeting with the Royal National Institute of Blind People, and ended up altering the site plan.","Other changes to address local feedback have included alterations to the road layout to avoid a potential rat run, as well as an increase in the number of parking spaces.","Brown also supported an event where local teenage students cooked a meal for elderly residents, which sparked discussions about intergenerational living."
2953,rat run,We are also asking people if the power to take enforcement action should be transferred from the police to the council – the police readily admit that they don’t have the resources to prioritise speeding offences.”,"And Battle Ward councillor Gul Khan added: “Residents are always raising concern at the dangerous speeds of some drivers, especially those using the side streets as a “rat run” to avoid traffic on the main through routes.",We hope as many people as possible will fill out the survey so we can judge the level of community support for any scheme.”
2954,rat run,"The unintended consequences of this new Tesco haven't been fully thought through.""","A council spokesman said: ""The issue of rat running was considered in some detail at the time of the planning application back in 2011, by the council and Transport for Greater Manchester.","It was concluded that if vehicles were to look for alternative routes to bypass the development site then this would be done over a relatively wide network which would vary on a day to day basis and no improvements to routes other than Dearden Street were considered to be appropriate."""
2955,rat run,Mr Ryan said that a second section of the road would be examined to see if it could integrate with other new housing or transport developments at the same time as building the road.,"Mr O'Dea claimed these amended plans would lead to a ""a rat run though a residential area of Moyross"", which would prevent investment linked to the development of the road.","He said support for green policies will depend on support for the policies of other parties, including this road, which is part of the ""compromise"" agreement that is  in the Programme for Government."
2956,rat run,Mr Ryan said he wanted to “look at the other section at the same time to see can we integrate new houses or other new transport at the same time we build the road”.,Mr O’Dea said the minister’s proposal to develop half of the project would turn Moyross into a “rat run” for motorists travelling through an area of the city earmarked for regeneration.,Mr O’Dea also said he would consider voting against Green Party commitments in the Programme for Government if Mr Ryan did not support the roads commitment in the coalition agreement.
2957,rat run,"But that comes despite opposition from people living in Hellesdon, who are worried about the impact of the development on them, particularly as Amazon has said van drivers will be on site from 5am.","There have been 18 objections to the scheme, with concern van drivers will 'rat run' down residential streets such as Low Road.","One said: ""As a local resident, I don't think the junction at the bottom of Hellesdon Hall Road and Low Road is sufficient to accept another 300 plus vans all coming and going at similar times of the day."
2958,rat run,"Andrew Smith, Westminster City Council’s cabinet member for environment and highways said: “While there is a recognition that the volume of traffic passing through the area is an issue, it is clear there is not a consensus in support of the proposed scheme.”",He said it was clear there was a problem with rat running through the estate and something had to be done “to manage the through traffic”.,The council said it would be working with residents and businesses to come up with a solution.
2959,rat run,According to a few commenters on the 'Berrylands Hub' facebook group they have noticed a much larger flow of traffic both ways on roads such as Raeburn Avenue.,This is likely due to cars choosing to still avoid the main road into Tolworth and using the smaller residential roads as 'rat runs'.,Cllr John Sweeney posted on a Surbiton Facebook group that 'lots of people quite like the LTN schemes once they've been put in place' adding 'at least they do in Brixton'.
